"","ID","Description","GeneRatio","BgRatio","pvalue","p.adjust","qvalue","geneID","Count"
"GO:1901077","GO:1901077","regulation of relaxation of muscle","1/31","15/21092",0.0218280647344876,0.137146142577064,0.0981215223748235,"Camk2d",1
"GO:0060401","GO:0060401","cytosolic calcium ion transport","2/31","160/21092",0.0230263002927602,0.137535448902523,0.0984000524785979,"Itpr1/Camk2d",2
"GO:0002407","GO:0002407","dendritic cell chemotaxis","1/31","16/21092",0.0232667576221486,0.137535448902523,0.0984000524785979,"Ccr7",1
"GO:0002864","GO:0002864","regulation of acute inflammatory response to antigenic stimulus","1/31","16/21092",0.0232667576221486,0.137535448902523,0.0984000524785979,"Ccr7",1
"GO:0002922","GO:0002922","positive regulation of humoral immune response","1/31","16/21092",0.0232667576221486,0.137535448902523,0.0984000524785979,"Ccr7",1
"GO:0006614","GO:0006614","SRP-dependent cotranslational protein targeting to membrane","1/31","16/21092",0.0232667576221486,0.137535448902523,0.0984000524785979,"Sec61b",1
"GO:0009312","GO:0009312","oligosaccharide biosynthetic process","1/31","16/21092",0.0232667576221486,0.137535448902523,0.0984000524785979,"B3galt2",1
"GO:0043383","GO:0043383","negative T cell selection","1/31","16/21092",0.0232667576221486,0.137535448902523,0.0984000524785979,"Ccr7",1
"GO:0051151","GO:0051151","negative regulation of smooth muscle cell differentiation","1/31","16/21092",0.0232667576221486,0.137535448902523,0.0984000524785979,"Klf5",1
"GO:1903543","GO:1903543","positive regulation of exosomal secretion","1/31","16/21092",0.0232667576221486,0.137535448902523,0.0984000524785979,"Sdc1",1
"GO:2000651","GO:2000651","positive regulation of sodium ion transmembrane transporter activity","1/31","16/21092",0.0232667576221486,0.137535448902523,0.0984000524785979,"Atp1b1",1
"GO:0016055","GO:0016055","Wnt signaling pathway","3/31","423/21092",0.023761186766343,0.137869828172786,0.0986392848947074,"Tmem131l/Sdc1/Tle4",3
"GO:0198738","GO:0198738","cell-cell signaling by wnt","3/31","425/21092",0.0240533365288164,0.137869828172786,0.0986392848947074,"Tmem131l/Sdc1/Tle4",3
"GO:1902107","GO:1902107","positive regulation of leukocyte differentiation","2/31","164/21092",0.0241082775609913,0.137869828172786,0.0986392848947074,"Ccr7/Cd83",2
"GO:0000729","GO:0000729","DNA double-strand break processing","1/31","17/21092",0.0247034026455744,0.137869828172786,0.0986392848947074,"Blm",1
"GO:0006613","GO:0006613","cotranslational protein targeting to membrane","1/31","17/21092",0.0247034026455744,0.137869828172786,0.0986392848947074,"Sec61b",1
"GO:0010880","GO:0010880","regulation of release of sequestered calcium ion into cytosol by sarcoplasmic reticulum","1/31","17/21092",0.0247034026455744,0.137869828172786,0.0986392848947074,"Camk2d",1
"GO:0030033","GO:0030033","microvillus assembly","1/31","17/21092",0.0247034026455744,0.137869828172786,0.0986392848947074,"Klf5",1
"GO:0070243","GO:0070243","regulation of thymocyte apoptotic process","1/31","17/21092",0.0247034026455744,0.137869828172786,0.0986392848947074,"Blm",1
"GO:0140131","GO:0140131","positive regulation of lymphocyte chemotaxis","1/31","17/21092",0.0247034026455744,0.137869828172786,0.0986392848947074,"Ccr7",1
"GO:1903541","GO:1903541","regulation of exosomal secretion","1/31","17/21092",0.0247034026455744,0.137869828172786,0.0986392848947074,"Sdc1",1
"GO:0001819","GO:0001819","positive regulation of cytokine production","3/31","435/21092",0.0255436455225213,0.139579615297333,0.0998625560158992,"Ccr7/Cd83/Fam49b",3
"GO:0000712","GO:0000712","resolution of meiotic recombination intermediates","1/31","18/21092",0.0261380026227028,0.139579615297333,0.0998625560158992,"Blm",1
"GO:0002577","GO:0002577","regulation of antigen processing and presentation","1/31","18/21092",0.0261380026227028,0.139579615297333,0.0998625560158992,"Ccr7",1
"GO:0006688","GO:0006688","glycosphingolipid biosynthetic process","1/31","18/21092",0.0261380026227028,0.139579615297333,0.0998625560158992,"B3galt2",1
"GO:0050961","GO:0050961","detection of temperature stimulus involved in sensory perception","1/31","18/21092",0.0261380026227028,0.139579615297333,0.0998625560158992,"Cxcr4",1
"GO:0050965","GO:0050965","detection of temperature stimulus involved in sensory perception of pain","1/31","18/21092",0.0261380026227028,0.139579615297333,0.0998625560158992,"Cxcr4",1
"GO:0060947","GO:0060947","cardiac vascular smooth muscle cell differentiation","1/31","18/21092",0.0261380026227028,0.139579615297333,0.0998625560158992,"Klf5",1
"GO:0014706","GO:0014706","striated muscle tissue development","3/31","441/21092",0.0264614780006588,0.139579615297333,0.0998625560158992,"Klf5/Cyp26b1/Camk2d",3
"GO:0140013","GO:0140013","meiotic nuclear division","2/31","174/21092",0.0269030578237994,0.139579615297333,0.0998625560158992,"Blm/Cyp26b1",2
"GO:0002643","GO:0002643","regulation of tolerance induction","1/31","19/21092",0.0275705603677298,0.139579615297333,0.0998625560158992,"Ccr7",1
"GO:0006883","GO:0006883","cellular sodium ion homeostasis","1/31","19/21092",0.0275705603677298,0.139579615297333,0.0998625560158992,"Atp1b1",1
"GO:0010766","GO:0010766","negative regulation of sodium ion transport","1/31","19/21092",0.0275705603677298,0.139579615297333,0.0998625560158992,"Camk2d",1
"GO:0010818","GO:0010818","T cell chemotaxis","1/31","19/21092",0.0275705603677298,0.139579615297333,0.0998625560158992,"Ccr7",1
"GO:0014808","GO:0014808","release of sequestered calcium ion into cytosol by sarcoplasmic reticulum","1/31","19/21092",0.0275705603677298,0.139579615297333,0.0998625560158992,"Camk2d",1
"GO:0034695","GO:0034695","response to prostaglandin E","1/31","19/21092",0.0275705603677298,0.139579615297333,0.0998625560158992,"Ccr7",1
"GO:0045766","GO:0045766","positive regulation of angiogenesis","2/31","180/21092",0.0286402236135232,0.139579615297333,0.0998625560158992,"Cxcr4/Rhoj",2
"GO:0035051","GO:0035051","cardiocyte differentiation","2/31","181/21092",0.0289340679562805,0.139579615297333,0.0998625560158992,"Klf5/Camk2d",2
"GO:0010560","GO:0010560","positive regulation of glycoprotein biosynthetic process","1/31","20/21092",0.0290010786911107,0.139579615297333,0.0998625560158992,"Ccr7",1
"GO:0010666","GO:0010666","positive regulation of cardiac muscle cell apoptotic process","1/31","20/21092",0.0290010786911107,0.139579615297333,0.0998625560158992,"Camk2d",1
"GO:0010759","GO:0010759","positive regulation of macrophage chemotaxis","1/31","20/21092",0.0290010786911107,0.139579615297333,0.0998625560158992,"Ccr7",1
"GO:0042573","GO:0042573","retinoic acid metabolic process","1/31","20/21092",0.0290010786911107,0.139579615297333,0.0998625560158992,"Cyp26b1",1
"GO:0050966","GO:0050966","detection of mechanical stimulus involved in sensory perception of pain","1/31","20/21092",0.0290010786911107,0.139579615297333,0.0998625560158992,"Cxcr4",1
"GO:0070498","GO:0070498","interleukin-1-mediated signaling pathway","1/31","20/21092",0.0290010786911107,0.139579615297333,0.0998625560158992,"St18",1
"GO:1903514","GO:1903514","release of sequestered calcium ion into cytosol by endoplasmic reticulum","1/31","20/21092",0.0290010786911107,0.139579615297333,0.0998625560158992,"Camk2d",1
"GO:0120032","GO:0120032","regulation of plasma membrane bounded cell projection assembly","2/31","183/21092",0.0295254207431182,0.139579615297333,0.0998625560158992,"Klf5/Ccr7",2
"GO:0060537","GO:0060537","muscle tissue development","3/31","462/21092",0.0298134371561763,0.139579615297333,0.0998625560158992,"Klf5/Cyp26b1/Camk2d",3
"GO:0002822","GO:0002822","regulation of adaptive immune response based on somatic recombination of immune receptors built from immunoglobulin superfamily domains","2/31","184/21092",0.0298229212432548,0.139579615297333,0.0998625560158992,"Ccr7/Fam49b",2
"GO:0060491","GO:0060491","regulation of cell projection assembly","2/31","185/21092",0.0301216325325234,0.139579615297333,0.0998625560158992,"Klf5/Ccr7",2
"GO:0010663","GO:0010663","positive regulation of striated muscle cell apoptotic process","1/31","21/21092",0.0304295603995656,0.139579615297333,0.0998625560158992,"Camk2d",1
"GO:0036336","GO:0036336","dendritic cell migration","1/31","21/21092",0.0304295603995656,0.139579615297333,0.0998625560158992,"Ccr7",1
"GO:0043586","GO:0043586","tongue development","1/31","21/21092",0.0304295603995656,0.139579615297333,0.0998625560158992,"Cyp26b1",1
"GO:0045063","GO:0045063","T-helper 1 cell differentiation","1/31","21/21092",0.0304295603995656,0.139579615297333,0.0998625560158992,"Ccr7",1
"GO:0070633","GO:0070633","transepithelial transport","1/31","21/21092",0.0304295603995656,0.139579615297333,0.0998625560158992,"Itpr1",1
"GO:0090050","GO:0090050","positive regulation of cell migration involved in sprouting angiogenesis","1/31","21/21092",0.0304295603995656,0.139579615297333,0.0998625560158992,"Rhoj",1
"GO:1990182","GO:1990182","exosomal secretion","1/31","21/21092",0.0304295603995656,0.139579615297333,0.0998625560158992,"Sdc1",1
"GO:0008015","GO:0008015","blood circulation","3/31","466/21092",0.0304764828714773,0.139579615297333,0.0998625560158992,"Cxcr4/Camk2d/Atp1b1",3
"GO:0007095","GO:0007095","mitotic G2 DNA damage checkpoint","1/31","22/21092",0.031856008296088,0.139579615297333,0.0998625560158992,"Blm",1
"GO:0016048","GO:0016048","detection of temperature stimulus","1/31","22/21092",0.031856008296088,0.139579615297333,0.0998625560158992,"Cxcr4",1
"GO:0034694","GO:0034694","response to prostaglandin","1/31","22/21092",0.031856008296088,0.139579615297333,0.0998625560158992,"Ccr7",1
"GO:0045624","GO:0045624","positive regulation of T-helper cell differentiation","1/31","22/21092",0.031856008296088,0.139579615297333,0.0998625560158992,"Ccr7",1
"GO:0046641","GO:0046641","positive regulation of alpha-beta T cell proliferation","1/31","22/21092",0.031856008296088,0.139579615297333,0.0998625560158992,"Blm",1
"GO:0050857","GO:0050857","positive regulation of antigen receptor-mediated signaling pathway","1/31","22/21092",0.031856008296088,0.139579615297333,0.0998625560158992,"Ccr7",1
"GO:0060575","GO:0060575","intestinal epithelial cell differentiation","1/31","22/21092",0.031856008296088,0.139579615297333,0.0998625560158992,"Klf5",1
"GO:0070242","GO:0070242","thymocyte apoptotic process","1/31","22/21092",0.031856008296088,0.139579615297333,0.0998625560158992,"Blm",1
"GO:0071312","GO:0071312","cellular response to alkaloid","1/31","22/21092",0.031856008296088,0.139579615297333,0.0998625560158992,"Blm",1
"GO:0097734","GO:0097734","extracellular exosome biogenesis","1/31","22/21092",0.031856008296088,0.139579615297333,0.0998625560158992,"Sdc1",1
"GO:1901623","GO:1901623","regulation of lymphocyte chemotaxis","1/31","22/21092",0.031856008296088,0.139579615297333,0.0998625560158992,"Ccr7",1
"GO:1902307","GO:1902307","positive regulation of sodium ion transmembrane transport","1/31","22/21092",0.031856008296088,0.139579615297333,0.0998625560158992,"Atp1b1",1
"GO:1903020","GO:1903020","positive regulation of glycoprotein metabolic process","1/31","22/21092",0.031856008296088,0.139579615297333,0.0998625560158992,"Ccr7",1
"GO:0003013","GO:0003013","circulatory system process","3/31","475/21092",0.0319970281956139,0.139585288940691,0.0998666152370574,"Cxcr4/Camk2d/Atp1b1",3
"GO:1903046","GO:1903046","meiotic cell cycle process","2/31","193/21092",0.0325544388734856,0.141399497541792,0.101164594943235,"Blm/Cyp26b1",2
"GO:0030539","GO:0030539","male genitalia development","1/31","23/21092",0.0332804251799429,0.142081815191295,0.101652760671081,"Asb1",1
"GO:0061436","GO:0061436","establishment of skin barrier","1/31","23/21092",0.0332804251799429,0.142081815191295,0.101652760671081,"Cyp26b1",1
"GO:1905208","GO:1905208","negative regulation of cardiocyte differentiation","1/31","23/21092",0.0332804251799429,0.142081815191295,0.101652760671081,"Klf5",1
"GO:1905523","GO:1905523","positive regulation of macrophage migration","1/31","23/21092",0.0332804251799429,0.142081815191295,0.101652760671081,"Ccr7",1
"GO:0010035","GO:0010035","response to inorganic substance","3/31","484/21092",0.0335572270127298,0.142600669865796,0.102023976438413,"Blm/Ccr7/Slc30a5",3
"GO:0007519","GO:0007519","skeletal muscle tissue development","2/31","197/21092",0.0337991796796795,0.142600669865796,0.102023976438413,"Klf5/Cyp26b1",2
"GO:0002819","GO:0002819","regulation of adaptive immune response","2/31","198/21092",0.0341132746992626,0.142600669865796,0.102023976438413,"Ccr7/Fam49b",2
"GO:1904018","GO:1904018","positive regulation of vasculature development","2/31","198/21092",0.0341132746992626,0.142600669865796,0.102023976438413,"Cxcr4/Rhoj",2
"GO:0002438","GO:0002438","acute inflammatory response to antigenic stimulus","1/31","24/21092",0.0347028138466772,0.142600669865796,0.102023976438413,"Ccr7",1
"GO:0002827","GO:0002827","positive regulation of T-helper 1 type immune response","1/31","24/21092",0.0347028138466772,0.142600669865796,0.102023976438413,"Ccr7",1
"GO:0090023","GO:0090023","positive regulation of neutrophil chemotaxis","1/31","24/21092",0.0347028138466772,0.142600669865796,0.102023976438413,"Ccr7",1
"GO:0090280","GO:0090280","positive regulation of calcium ion import","1/31","24/21092",0.0347028138466772,0.142600669865796,0.102023976438413,"Cxcr4",1
"GO:0140112","GO:0140112","extracellular vesicle biogenesis","1/31","24/21092",0.0347028138466772,0.142600669865796,0.102023976438413,"Sdc1",1
"GO:1903708","GO:1903708","positive regulation of hemopoiesis","2/31","204/21092",0.0360219916227689,0.142600669865796,0.102023976438413,"Ccr7/Cd83",2
"GO:0042044","GO:0042044","fluid transport","1/31","25/21092",0.0361231770881214,0.142600669865796,0.102023976438413,"Itpr1",1
"GO:0048714","GO:0048714","positive regulation of oligodendrocyte differentiation","1/31","25/21092",0.0361231770881214,0.142600669865796,0.102023976438413,"Cxcr4",1
"GO:2000780","GO:2000780","negative regulation of double-strand break repair","1/31","25/21092",0.0361231770881214,0.142600669865796,0.102023976438413,"Blm",1
"GO:0060538","GO:0060538","skeletal muscle organ development","2/31","206/21092",0.0366673378585525,0.142600669865796,0.102023976438413,"Klf5/Cyp26b1",2
"GO:0097305","GO:0097305","response to alcohol","2/31","208/21092",0.0373171871756723,0.142600669865796,0.102023976438413,"Blm/Ccr7",2
"GO:0000731","GO:0000731","DNA synthesis involved in DNA repair","1/31","26/21092",0.0375415176923968,0.142600669865796,0.102023976438413,"Blm",1
"GO:0006312","GO:0006312","mitotic recombination","1/31","26/21092",0.0375415176923968,0.142600669865796,0.102023976438413,"Blm",1
"GO:0006882","GO:0006882","cellular zinc ion homeostasis","1/31","26/21092",0.0375415176923968,0.142600669865796,0.102023976438413,"Slc30a5",1
"GO:0010165","GO:0010165","response to X-ray","1/31","26/21092",0.0375415176923968,0.142600669865796,0.102023976438413,"Blm",1
"GO:0030970","GO:0030970","retrograde protein transport, ER to cytosol","1/31","26/21092",0.0375415176923968,0.142600669865796,0.102023976438413,"Sec61b",1
"GO:0032528","GO:0032528","microvillus organization","1/31","26/21092",0.0375415176923968,0.142600669865796,0.102023976438413,"Klf5",1
"GO:0045738","GO:0045738","negative regulation of DNA repair","1/31","26/21092",0.0375415176923968,0.142600669865796,0.102023976438413,"Blm",1
"GO:0050849","GO:0050849","negative regulation of calcium-mediated signaling","1/31","26/21092",0.0375415176923968,0.142600669865796,0.102023976438413,"Itpr1",1
"GO:0050951","GO:0050951","sensory perception of temperature stimulus","1/31","26/21092",0.0375415176923968,0.142600669865796,0.102023976438413,"Cxcr4",1
"GO:0070233","GO:0070233","negative regulation of T cell apoptotic process","1/31","26/21092",0.0375415176923968,0.142600669865796,0.102023976438413,"Blm",1
"GO:0071624","GO:0071624","positive regulation of granulocyte chemotaxis","1/31","26/21092",0.0375415176923968,0.142600669865796,0.102023976438413,"Ccr7",1
"GO:0098901","GO:0098901","regulation of cardiac muscle cell action potential","1/31","26/21092",0.0375415176923968,0.142600669865796,0.102023976438413,"Camk2d",1
"GO:1901018","GO:1901018","positive regulation of potassium ion transmembrane transporter activity","1/31","26/21092",0.0375415176923968,0.142600669865796,0.102023976438413,"Atp1b1",1
"GO:1903513","GO:1903513","endoplasmic reticulum to cytosol transport","1/31","26/21092",0.0375415176923968,0.142600669865796,0.102023976438413,"Sec61b",1
"GO:0050920","GO:0050920","regulation of chemotaxis","2/31","211/21092",0.0383003385401146,0.143084119873065,0.102369861855341,"Cxcr4/Ccr7",2
"GO:0006814","GO:0006814","sodium ion transport","2/31","212/21092",0.0386302746356416,0.143084119873065,0.102369861855341,"Camk2d/Atp1b1",2
"GO:0002507","GO:0002507","tolerance induction","1/31","27/21092",0.0389578384439176,0.143084119873065,0.102369861855341,"Ccr7",1
"GO:0031295","GO:0031295","T cell costimulation","1/31","27/21092",0.0389578384439176,0.143084119873065,0.102369861855341,"Ccr7",1
"GO:0033561","GO:0033561","regulation of water loss via skin","1/31","27/21092",0.0389578384439176,0.143084119873065,0.102369861855341,"Cyp26b1",1
"GO:0055069","GO:0055069","zinc ion homeostasis","1/31","27/21092",0.0389578384439176,0.143084119873065,0.102369861855341,"Slc30a5",1
"GO:0070296","GO:0070296","sarcoplasmic reticulum calcium ion transport","1/31","27/21092",0.0389578384439176,0.143084119873065,0.102369861855341,"Camk2d",1
"GO:1903861","GO:1903861","positive regulation of dendrite extension","1/31","27/21092",0.0389578384439176,0.143084119873065,0.102369861855341,"Cxcr4",1
"GO:2000781","GO:2000781","positive regulation of double-strand break repair","1/31","27/21092",0.0389578384439176,0.143084119873065,0.102369861855341,"Blm",1
"GO:0034976","GO:0034976","response to endoplasmic reticulum stress","2/31","216/21092",0.0399610144437286,0.146129601381426,0.104548758588049,"Sec61b/Itpr1",2
"GO:0045061","GO:0045061","thymic T cell selection","1/31","28/21092",0.040372142123397,0.146129601381426,0.104548758588049,"Ccr7",1
"GO:0051307","GO:0051307","meiotic chromosome separation","1/31","28/21092",0.040372142123397,0.146129601381426,0.104548758588049,"Blm",1
"GO:0061298","GO:0061298","retina vasculature development in camera-type eye","1/31","28/21092",0.040372142123397,0.146129601381426,0.104548758588049,"Rhoj",1
"GO:0060828","GO:0060828","regulation of canonical Wnt signaling pathway","2/31","220/21092",0.0413091690750462,0.146981151677271,0.105158002201009,"Tmem131l/Tle4",2
"GO:0002675","GO:0002675","positive regulation of acute inflammatory response","1/31","29/21092",0.0417844315078529,0.146981151677271,0.105158002201009,"Ccr7",1
"GO:0008045","GO:0008045","motor neuron axon guidance","1/31","29/21092",0.0417844315078529,0.146981151677271,0.105158002201009,"Cxcr4",1
"GO:0009225","GO:0009225","nucleotide-sugar metabolic process","1/31","29/21092",0.0417844315078529,0.146981151677271,0.105158002201009,"Gmds",1
"GO:0009303","GO:0009303","rRNA transcription","1/31","29/21092",0.0417844315078529,0.146981151677271,0.105158002201009,"Polr1a",1
"GO:0031294","GO:0031294","lymphocyte costimulation","1/31","29/21092",0.0417844315078529,0.146981151677271,0.105158002201009,"Ccr7",1
"GO:0048384","GO:0048384","retinoic acid receptor signaling pathway","1/31","29/21092",0.0417844315078529,0.146981151677271,0.105158002201009,"Cyp26b1",1
"GO:0071354","GO:0071354","cellular response to interleukin-6","1/31","29/21092",0.0417844315078529,0.146981151677271,0.105158002201009,"St18",1
"GO:0002861","GO:0002861","regulation of inflammatory response to antigenic stimulus","1/31","30/21092",0.0431947093706103,0.148527918342755,0.10626463996073,"Ccr7",1
"GO:0010758","GO:0010758","regulation of macrophage chemotaxis","1/31","30/21092",0.0431947093706103,0.148527918342755,0.10626463996073,"Ccr7",1
"GO:0031297","GO:0031297","replication fork processing","1/31","30/21092",0.0431947093706103,0.148527918342755,0.10626463996073,"Blm",1
"GO:0048643","GO:0048643","positive regulation of skeletal muscle tissue development","1/31","30/21092",0.0431947093706103,0.148527918342755,0.10626463996073,"Cyp26b1",1
"GO:0090022","GO:0090022","regulation of neutrophil chemotaxis","1/31","30/21092",0.0431947093706103,0.148527918342755,0.10626463996073,"Ccr7",1
"GO:1903859","GO:1903859","regulation of dendrite extension","1/31","30/21092",0.0431947093706103,0.148527918342755,0.10626463996073,"Cxcr4",1
"GO:0002825","GO:0002825","regulation of T-helper 1 type immune response","1/31","31/21092",0.0446029784813079,0.148527918342755,0.10626463996073,"Ccr7",1
"GO:0010043","GO:0010043","response to zinc ion","1/31","31/21092",0.0446029784813079,0.148527918342755,0.10626463996073,"Slc30a5",1
"GO:0032673","GO:0032673","regulation of interleukin-4 production","1/31","31/21092",0.0446029784813079,0.148527918342755,0.10626463996073,"Cd83",1
"GO:0033081","GO:0033081","regulation of T cell differentiation in thymus","1/31","31/21092",0.0446029784813079,0.148527918342755,0.10626463996073,"Tmem131l",1
"GO:0045047","GO:0045047","protein targeting to ER","1/31","31/21092",0.0446029784813079,0.148527918342755,0.10626463996073,"Sec61b",1
"GO:0048535","GO:0048535","lymph node development","1/31","31/21092",0.0446029784813079,0.148527918342755,0.10626463996073,"Ccr7",1
"GO:0051491","GO:0051491","positive regulation of filopodium assembly","1/31","31/21092",0.0446029784813079,0.148527918342755,0.10626463996073,"Ccr7",1
"GO:0070741","GO:0070741","response to interleukin-6","1/31","31/21092",0.0446029784813079,0.148527918342755,0.10626463996073,"St18",1
"GO:1902624","GO:1902624","positive regulation of neutrophil migration","1/31","31/21092",0.0446029784813079,0.148527918342755,0.10626463996073,"Ccr7",1
"GO:2001014","GO:2001014","regulation of skeletal muscle cell differentiation","1/31","31/21092",0.0446029784813079,0.148527918342755,0.10626463996073,"Cyp26b1",1
"GO:0090257","GO:0090257","regulation of muscle system process","2/31","232/21092",0.0454557768689982,0.150699122505889,0.107818032960854,"Camk2d/Atp1b1",2
"GO:0006775","GO:0006775","fat-soluble vitamin metabolic process","1/31","32/21092",0.0460092416059021,0.150699122505889,0.107818032960854,"Cyp26b1",1
"GO:0006829","GO:0006829","zinc ion transport","1/31","32/21092",0.0460092416059021,0.150699122505889,0.107818032960854,"Slc30a5",1
"GO:0032508","GO:0032508","DNA duplex unwinding","1/31","32/21092",0.0460092416059021,0.150699122505889,0.107818032960854,"Blm",1
"GO:0044818","GO:0044818","mitotic G2/M transition checkpoint","1/31","32/21092",0.0460092416059021,0.150699122505889,0.107818032960854,"Blm",1
"GO:0002920","GO:0002920","regulation of humoral immune response","1/31","33/21092",0.0474135015066717,0.151814384631939,0.108615949807794,"Ccr7",1
"GO:0031572","GO:0031572","G2 DNA damage checkpoint","1/31","33/21092",0.0474135015066717,0.151814384631939,0.108615949807794,"Blm",1
"GO:0032733","GO:0032733","positive regulation of interleukin-10 production","1/31","33/21092",0.0474135015066717,0.151814384631939,0.108615949807794,"Cd83",1
"GO:0032743","GO:0032743","positive regulation of interleukin-2 production","1/31","33/21092",0.0474135015066717,0.151814384631939,0.108615949807794,"Cd83",1
"GO:0140115","GO:0140115","export across plasma membrane","1/31","33/21092",0.0474135015066717,0.151814384631939,0.108615949807794,"Atp1b1",1
"GO:1900181","GO:1900181","negative regulation of protein localization to nucleus","1/31","33/21092",0.0474135015066717,0.151814384631939,0.108615949807794,"Polr1a",1
"GO:1902895","GO:1902895","positive regulation of pri-miRNA transcription by RNA polymerase II","1/31","33/21092",0.0474135015066717,0.151814384631939,0.108615949807794,"Klf5",1
"GO:0032412","GO:0032412","regulation of ion transmembrane transporter activity","2/31","240/21092",0.0483029917885609,0.152874436304959,0.109374366209438,"Camk2d/Atp1b1",2
"GO:0031424","GO:0031424","keratinization","1/31","34/21092",0.0488157609422241,0.152874436304959,0.109374366209438,"Cyp26b1",1
"GO:0032735","GO:0032735","positive regulation of interleukin-12 production","1/31","34/21092",0.0488157609422241,0.152874436304959,0.109374366209438,"Ccr7",1
"GO:0097366","GO:0097366","response to bronchodilator","1/31","34/21092",0.0488157609422241,0.152874436304959,0.109374366209438,"Ccr7",1
"GO:1905521","GO:1905521","regulation of macrophage migration","1/31","34/21092",0.0488157609422241,0.152874436304959,0.109374366209438,"Ccr7",1
"GO:2000036","GO:2000036","regulation of stem cell population maintenance","1/31","34/21092",0.0488157609422241,0.152874436304959,0.109374366209438,"Nfya",1
"GO:2000406","GO:2000406","positive regulation of T cell migration","1/31","34/21092",0.0488157609422241,0.152874436304959,0.109374366209438,"Ccr7",1
"GO:0032147","GO:0032147","activation of protein kinase activity","2/31","243/21092",0.049387326833567,0.154181060958542,0.110309193815763,"Ccr7/Sbk2",2
"GO:0002064","GO:0002064","epithelial cell development","2/31","245/21092",0.0501151800373577,0.154832736558115,0.110775436618682,"Klf5/Cxcr4",2
"GO:0009954","GO:0009954","proximal/distal pattern formation","1/31","35/21092",0.0502160226674967,0.154832736558115,0.110775436618682,"Cyp26b1",1
"GO:0050718","GO:0050718","positive regulation of interleukin-1 beta secretion","1/31","35/21092",0.0502160226674967,0.154832736558115,0.110775436618682,"Ccr7",1
"GO:0072599","GO:0072599","establishment of protein localization to endoplasmic reticulum","1/31","35/21092",0.0502160226674967,0.154832736558115,0.110775436618682,"Sec61b",1
"GO:0022898","GO:0022898","regulation of transmembrane transporter activity","2/31","248/21092",0.0512143350035052,0.156576826654508,0.112023249879786,"Camk2d/Atp1b1",2
"GO:0016601","GO:0016601","Rac protein signal transduction","1/31","36/21092",0.0516142894337648,0.156576826654508,0.112023249879786,"Camk2d",1
"GO:0035886","GO:0035886","vascular smooth muscle cell differentiation","1/31","36/21092",0.0516142894337648,0.156576826654508,0.112023249879786,"Klf5",1
