"","ID","Description","GeneRatio","BgRatio","pvalue","p.adjust","qvalue","geneID","Count"
"GO:0050863","GO:0050863","regulation of T cell activation","6/31","301/21092",4.38153190716679e-06,0.00264970102352302,0.00189573467675268,"Tmem131l/Blm/Ccr7/Cyp26b1/Cd83/Fam49b",6
"GO:0042110","GO:0042110","T cell activation","7/31","485/21092",5.30470675379984e-06,0.00264970102352302,0.00189573467675268,"Tmem131l/Cxcr4/Blm/Ccr7/Cyp26b1/Cd83/Fam49b",7
"GO:0051249","GO:0051249","regulation of lymphocyte activation","6/31","421/21092",2.94307856050277e-05,0.00955871653480488,0.00683880567634214,"Tmem131l/Blm/Ccr7/Cyp26b1/Cd83/Fam49b",6
"GO:0030217","GO:0030217","T cell differentiation","5/31","264/21092",3.85055652470218e-05,0.00955871653480488,0.00683880567634214,"Tmem131l/Blm/Ccr7/Cyp26b1/Cd83",5
"GO:1903037","GO:1903037","regulation of leukocyte cell-cell adhesion","5/31","284/21092",5.44896060412618e-05,0.00955871653480488,0.00683880567634214,"Tmem131l/Blm/Ccr7/Cd83/Fam49b",5
"GO:0045580","GO:0045580","regulation of T cell differentiation","4/31","148/21092",6.31987558864617e-05,0.00955871653480488,0.00683880567634214,"Tmem131l/Ccr7/Cyp26b1/Cd83",4
"GO:0072503","GO:0072503","cellular divalent inorganic cation homeostasis","6/31","488/21092",6.69779937373715e-05,0.00955871653480488,0.00683880567634214,"Cxcr4/Itpr1/Ccr7/Slc30a5/Camk2d/Atp1b1",6
"GO:0007159","GO:0007159","leukocyte cell-cell adhesion","5/31","317/21092",9.15904337070836e-05,0.0114373554091721,0.00818288216935655,"Tmem131l/Blm/Ccr7/Cd83/Fam49b",5
"GO:0045619","GO:0045619","regulation of lymphocyte differentiation","4/31","180/21092",0.000134801689068329,0.0134267006887193,0.00960616381396173,"Tmem131l/Ccr7/Cyp26b1/Cd83",4
"GO:0046635","GO:0046635","positive regulation of alpha-beta T cell activation","3/31","68/21092",0.000135041722354584,0.0134267006887193,0.00960616381396173,"Blm/Ccr7/Cd83",3
"GO:0050870","GO:0050870","positive regulation of T cell activation","4/31","185/21092",0.000149783864473496,0.0134267006887193,0.00960616381396173,"Blm/Ccr7/Cd83/Fam49b",4
"GO:0055119","GO:0055119","relaxation of cardiac muscle","2/31","13/21092",0.000161429544271282,0.0134267006887193,0.00960616381396173,"Camk2d/Atp1b1",2
"GO:1903039","GO:1903039","positive regulation of leukocyte cell-cell adhesion","4/31","196/21092",0.000186943857633769,0.0134267006887193,0.00960616381396173,"Blm/Ccr7/Cd83/Fam49b",4
"GO:0030007","GO:0030007","cellular potassium ion homeostasis","2/31","14/21092",0.000188161971613683,0.0134267006887193,0.00960616381396173,"Camk2d/Atp1b1",2
"GO:0042098","GO:0042098","T cell proliferation","4/31","208/21092",0.000234628309563032,0.0137529577872447,0.00983958520366597,"Tmem131l/Cxcr4/Blm/Ccr7",4
"GO:0030098","GO:0030098","lymphocyte differentiation","5/31","388/21092",0.00023519958558255,0.0137529577872447,0.00983958520366597,"Tmem131l/Blm/Ccr7/Cyp26b1/Cd83",5
"GO:0022407","GO:0022407","regulation of cell-cell adhesion","5/31","392/21092",0.000246621555072195,0.0137529577872447,0.00983958520366597,"Tmem131l/Blm/Ccr7/Cd83/Fam49b",5
"GO:0019722","GO:0019722","calcium-mediated signaling","4/31","211/21092",0.000247801041211617,0.0137529577872447,0.00983958520366597,"Cxcr4/Itpr1/Ccr7/Atp1b1",4
"GO:0022409","GO:0022409","positive regulation of cell-cell adhesion","4/31","236/21092",0.000379165340594978,0.0199361144870728,0.0142633388511906,"Blm/Ccr7/Cd83/Fam49b",4
"GO:0046634","GO:0046634","regulation of alpha-beta T cell activation","3/31","102/21092",0.000447286985457567,0.0219148349830437,0.0156790189700086,"Blm/Ccr7/Cd83",3
"GO:0070838","GO:0070838","divalent metal ion transport","5/31","457/21092",0.000498466693761785,0.0219148349830437,0.0156790189700086,"Cxcr4/Itpr1/Slc30a5/Camk2d/Atp1b1",5
"GO:0072511","GO:0072511","divalent inorganic cation transport","5/31","460/21092",0.000513525232129333,0.0219148349830437,0.0156790189700086,"Cxcr4/Itpr1/Slc30a5/Camk2d/Atp1b1",5
"GO:0006874","GO:0006874","cellular calcium ion homeostasis","5/31","463/21092",0.000528925165226531,0.0219148349830437,0.0156790189700086,"Cxcr4/Itpr1/Ccr7/Camk2d/Atp1b1",5
"GO:0046632","GO:0046632","alpha-beta T cell differentiation","3/31","110/21092",0.000557772125836348,0.0219148349830437,0.0156790189700086,"Blm/Ccr7/Cd83",3
"GO:0051924","GO:0051924","regulation of calcium ion transport","4/31","262/21092",0.000562256585520391,0.0219148349830437,0.0156790189700086,"Cxcr4/Itpr1/Camk2d/Atp1b1",4
"GO:0051251","GO:0051251","positive regulation of lymphocyte activation","4/31","263/21092",0.00057035606562476,0.0219148349830437,0.0156790189700086,"Blm/Ccr7/Cd83/Fam49b",4
"GO:0032469","GO:0032469","endoplasmic reticulum calcium ion homeostasis","2/31","25/21092",0.000614096052008426,0.0222236552375424,0.0158999651296468,"Itpr1/Camk2d",2
"GO:0055074","GO:0055074","calcium ion homeostasis","5/31","480/21092",0.00062288523188307,0.0222236552375424,0.0158999651296468,"Cxcr4/Itpr1/Ccr7/Camk2d/Atp1b1",5
"GO:0060048","GO:0060048","cardiac muscle contraction","3/31","121/21092",0.000736179873946633,0.0253601273818168,0.0181439613215885,"Cxcr4/Camk2d/Atp1b1",3
"GO:1902105","GO:1902105","regulation of leukocyte differentiation","4/31","290/21092",0.000821950999537914,0.0273709682846125,0.0195826220591665,"Tmem131l/Ccr7/Cyp26b1/Cd83",4
"GO:0043372","GO:0043372","positive regulation of CD4-positive, alpha-beta T cell differentiation","2/31","30/21092",0.000886373487891567,0.0274400637746787,0.0196320565860669,"Ccr7/Cd83",2
"GO:0055075","GO:0055075","potassium ion homeostasis","2/31","30/21092",0.000886373487891567,0.0274400637746787,0.0196320565860669,"Camk2d/Atp1b1",2
"GO:0051928","GO:0051928","positive regulation of calcium ion transport","3/31","130/21092",0.000906428533097494,0.0274400637746787,0.0196320565860669,"Cxcr4/Itpr1/Atp1b1",3
"GO:0090075","GO:0090075","relaxation of muscle","2/31","31/21092",0.000946636049684443,0.0278143945186694,0.0198998723757194,"Camk2d/Atp1b1",2
"GO:0046651","GO:0046651","lymphocyte proliferation","4/31","307/21092",0.00101567550684276,0.0285608268416946,0.0204339090938419,"Tmem131l/Cxcr4/Blm/Ccr7",4
"GO:0032943","GO:0032943","mononuclear cell proliferation","4/31","309/21092",0.00104040425440694,0.0285608268416946,0.0204339090938419,"Tmem131l/Cxcr4/Blm/Ccr7",4
"GO:0051150","GO:0051150","regulation of smooth muscle cell differentiation","2/31","33/21092",0.00107292478126042,0.0285608268416946,0.0204339090938419,"Olfm2/Klf5",2
"GO:0002696","GO:0002696","positive regulation of leukocyte activation","4/31","313/21092",0.00109113104548683,0.0285608268416946,0.0204339090938419,"Blm/Ccr7/Cd83/Fam49b",4
"GO:2000516","GO:2000516","positive regulation of CD4-positive, alpha-beta T cell activation","2/31","34/21092",0.00113894013345009,0.0285608268416946,0.0204339090938419,"Ccr7/Cd83",2
"GO:0007204","GO:0007204","positive regulation of cytosolic calcium ion concentration","4/31","317/21092",0.0011435766503181,0.0285608268416946,0.0204339090938419,"Cxcr4/Itpr1/Ccr7/Camk2d",4
"GO:0070661","GO:0070661","leukocyte proliferation","4/31","325/21092",0.00125375113975113,0.0305487167953996,0.0218561495222341,"Tmem131l/Cxcr4/Blm/Ccr7",4
"GO:0050867","GO:0050867","positive regulation of cell activation","4/31","328/21092",0.00129692357496103,0.0308482536044303,0.0220704538195123,"Blm/Ccr7/Cd83/Fam49b",4
"GO:0006941","GO:0006941","striated muscle contraction","3/31","153/21092",0.00144941399088984,0.0329082858386125,0.0235443086079952,"Cxcr4/Camk2d/Atp1b1",3
"GO:0046631","GO:0046631","alpha-beta T cell activation","3/31","153/21092",0.00144941399088984,0.0329082858386125,0.0235443086079952,"Blm/Ccr7/Cd83",3
"GO:0051147","GO:0051147","regulation of muscle cell differentiation","3/31","160/21092",0.00164755542210661,0.0365757303707668,0.0261681902131085,"Olfm2/Klf5/Cyp26b1",3
"GO:0051480","GO:0051480","regulation of cytosolic calcium ion concentration","4/31","365/21092",0.00191852228449841,0.0416652991785632,0.0298095338941515,"Cxcr4/Itpr1/Ccr7/Camk2d",4
"GO:0042129","GO:0042129","regulation of T cell proliferation","3/31","174/21092",0.002092967161651,0.0444866849891351,0.0318281008457118,"Tmem131l/Blm/Ccr7",3
"GO:0042692","GO:0042692","muscle cell differentiation","4/31","383/21092",0.00228525642173475,0.0475618992773544,0.0340282699639889,"Olfm2/Klf5/Cyp26b1/Camk2d",4
"GO:0046638","GO:0046638","positive regulation of alpha-beta T cell differentiation","2/31","49/21092",0.00235499197694375,0.0480129996932002,0.0343510107915104,"Ccr7/Cd83",2
"GO:0043370","GO:0043370","regulation of CD4-positive, alpha-beta T cell differentiation","2/31","50/21092",0.00245087631283807,0.0489685087305046,0.0350346319245695,"Ccr7/Cd83",2
"GO:2000649","GO:2000649","regulation of sodium ion transmembrane transporter activity","2/31","51/21092",0.00254858262762091,0.049922236176339,0.0357169784139236,"Camk2d/Atp1b1",2
"GO:1903706","GO:1903706","regulation of hemopoiesis","4/31","398/21092",0.00262585129575754,0.0504466431627265,0.0360921665955337,"Tmem131l/Ccr7/Cyp26b1/Cd83",4
"GO:0045785","GO:0045785","positive regulation of cell adhesion","4/31","405/21092",0.00279617338677925,0.0527052304413673,0.0377080780461392,"Blm/Ccr7/Cd83/Fam49b",4
"GO:0006816","GO:0006816","calcium ion transport","4/31","409/21092",0.00289684203899561,0.0530812962121053,0.0379771351646589,"Cxcr4/Itpr1/Camk2d/Atp1b1",4
"GO:0010959","GO:0010959","regulation of metal ion transport","4/31","410/21092",0.00292239368535115,0.0530812962121053,0.0379771351646589,"Cxcr4/Itpr1/Camk2d/Atp1b1",4
"GO:0001666","GO:0001666","response to hypoxia","3/31","206/21092",0.00337383502286421,0.0586985110106796,0.0419959843804346,"Itpr1/Camk2d/Atp1b1",3
"GO:0060047","GO:0060047","heart contraction","3/31","207/21092",0.00342006271520525,0.0586985110106796,0.0419959843804346,"Cxcr4/Camk2d/Atp1b1",3
"GO:0019932","GO:0019932","second-messenger-mediated signaling","4/31","430/21092",0.00346654594892163,0.0586985110106796,0.0419959843804346,"Cxcr4/Itpr1/Ccr7/Atp1b1",4
"GO:0007163","GO:0007163","establishment or maintenance of cell polarity","3/31","208/21092",0.00346667882845855,0.0586985110106796,0.0419959843804346,"Ccr7/Cyp26b1/Rhoj",3
"GO:1902305","GO:1902305","regulation of sodium ion transmembrane transport","2/31","61/21092",0.00362471344789535,0.0603514789074576,0.0431786040547534,"Camk2d/Atp1b1",2
"GO:2000514","GO:2000514","regulation of CD4-positive, alpha-beta T cell activation","2/31","62/21092",0.00374211992855876,0.0612848821086919,0.0438464095166764,"Ccr7/Cd83",2
"GO:0003015","GO:0003015","heart process","3/31","215/21092",0.00380395527722142,0.0612927632571644,0.0438520481024336,"Cxcr4/Camk2d/Atp1b1",3
"GO:0046637","GO:0046637","regulation of alpha-beta T cell differentiation","2/31","67/21092",0.00435545288647802,0.0690650386284371,0.0494127403495167,"Ccr7/Cd83",2
"GO:0050670","GO:0050670","regulation of lymphocyte proliferation","3/31","228/21092",0.00448214816115176,0.0693097305126804,0.0495878057195195,"Tmem131l/Blm/Ccr7",3
"GO:0032944","GO:0032944","regulation of mononuclear cell proliferation","3/31","230/21092",0.00459257217145568,0.0693097305126804,0.0495878057195195,"Tmem131l/Blm/Ccr7",3
"GO:2000107","GO:2000107","negative regulation of leukocyte apoptotic process","2/31","69/21092",0.00461296516276362,0.0693097305126804,0.0495878057195195,"Blm/Ccr7",2
"GO:0036293","GO:0036293","response to decreased oxygen levels","3/31","231/21092",0.00464840034469428,0.0693097305126804,0.0495878057195195,"Itpr1/Camk2d/Atp1b1",3
"GO:0051145","GO:0051145","smooth muscle cell differentiation","2/31","73/21092",0.00514864676611532,0.0748453819602741,0.0535483002486972,"Olfm2/Klf5",2
"GO:0070663","GO:0070663","regulation of leukocyte proliferation","3/31","240/21092",0.00516950085611502,0.0748453819602741,0.0535483002486972,"Tmem131l/Blm/Ccr7",3
"GO:0043367","GO:0043367","CD4-positive, alpha-beta T cell differentiation","2/31","80/21092",0.00615153246787535,0.0877911562201067,0.0628103841456746,"Ccr7/Cd83",2
"GO:0010389","GO:0010389","regulation of G2/M transition of mitotic cell cycle","2/31","81/21092",0.00630152190846485,0.0886650758669913,0.0634356319621591,"Blm/Camk2d",2
"GO:0070588","GO:0070588","calcium ion transmembrane transport","3/31","271/21092",0.00722839548666882,0.0998978292248129,0.0714721311244381,"Itpr1/Camk2d/Atp1b1",3
"GO:0033077","GO:0033077","T cell differentiation in thymus","2/31","89/21092",0.00756097707640804,0.0998978292248129,0.0714721311244381,"Tmem131l/Ccr7",2
"GO:0035914","GO:0035914","skeletal muscle cell differentiation","2/31","89/21092",0.00756097707640804,0.0998978292248129,0.0714721311244381,"Klf5/Cyp26b1",2
"GO:0051149","GO:0051149","positive regulation of muscle cell differentiation","2/31","89/21092",0.00756097707640804,0.0998978292248129,0.0714721311244381,"Olfm2/Cyp26b1",2
"GO:0060070","GO:0060070","canonical Wnt signaling pathway","3/31","276/21092",0.00759983485594172,0.0998978292248129,0.0714721311244381,"Tmem131l/Sdc1/Tle4",3
"GO:0070482","GO:0070482","response to oxygen levels","3/31","280/21092",0.00790502629786716,0.1019263447115,0.0729234371836137,"Itpr1/Camk2d/Atp1b1",3
"GO:0006936","GO:0006936","muscle contraction","3/31","281/21092",0.00798244618649685,0.1019263447115,0.0729234371836137,"Cxcr4/Camk2d/Atp1b1",3
"GO:0002028","GO:0002028","regulation of sodium ion transport","2/31","92/21092",0.0080602414736822,0.1019263447115,0.0729234371836137,"Camk2d/Atp1b1",2
"GO:0030004","GO:0030004","cellular monovalent inorganic cation homeostasis","2/31","93/21092",0.00822989330760024,0.102770792678658,0.073527599419218,"Camk2d/Atp1b1",2
"GO:0045582","GO:0045582","positive regulation of T cell differentiation","2/31","94/21092",0.00840115234427555,0.103614212246065,0.074131025883861,"Ccr7/Cd83",2
"GO:0035710","GO:0035710","CD4-positive, alpha-beta T cell activation","2/31","96/21092",0.00874847293927527,0.105297885136578,0.0753356135163971,"Ccr7/Cd83",2
"GO:1902749","GO:1902749","regulation of cell cycle G2/M phase transition","2/31","96/21092",0.00874847293927527,0.105297885136578,0.0753356135163971,"Blm/Camk2d",2
"GO:0042102","GO:0042102","positive regulation of T cell proliferation","2/31","99/21092",0.0092813888172416,0.110382231290766,0.0789732206379329,"Blm/Ccr7",2
"GO:0043270","GO:0043270","positive regulation of ion transport","3/31","310/21092",0.0104257811662063,0.122511201249031,0.0876509200232782,"Cxcr4/Itpr1/Atp1b1",3
"GO:0035725","GO:0035725","sodium ion transmembrane transport","2/31","107/21092",0.0107716163460284,0.122511201249031,0.0876509200232782,"Camk2d/Atp1b1",2
"GO:0051209","GO:0051209","release of sequestered calcium ion into cytosol","2/31","107/21092",0.0107716163460284,0.122511201249031,0.0876509200232782,"Itpr1/Camk2d",2
"GO:0045621","GO:0045621","positive regulation of lymphocyte differentiation","2/31","108/21092",0.0109648793644725,0.122511201249031,0.0876509200232782,"Ccr7/Cd83",2
"GO:0032649","GO:0032649","regulation of interferon-gamma production","2/31","109/21092",0.0111596789926545,0.122511201249031,0.0876509200232782,"Ccr7/Fam49b",2
"GO:0051283","GO:0051283","negative regulation of sequestering of calcium ion","2/31","109/21092",0.0111596789926545,0.122511201249031,0.0876509200232782,"Itpr1/Camk2d",2
"GO:2000106","GO:2000106","regulation of leukocyte apoptotic process","2/31","109/21092",0.0111596789926545,0.122511201249031,0.0876509200232782,"Blm/Ccr7",2
"GO:0051282","GO:0051282","regulation of sequestering of calcium ion","2/31","111/21092",0.011553869570653,0.125459953272634,0.0897606114241805,"Itpr1/Camk2d",2
"GO:0051208","GO:0051208","sequestering of calcium ion","2/31","112/21092",0.0117532512904665,0.126252667087914,0.0903277603421249,"Itpr1/Camk2d",2
"GO:0000086","GO:0000086","G2/M transition of mitotic cell cycle","2/31","115/21092",0.0123604869923985,0.131363047929852,0.0939839940407456,"Blm/Camk2d",2
"GO:1901342","GO:1901342","regulation of vasculature development","3/31","335/21092",0.0128460180997713,0.135086021912332,0.0966476043185012,"Klf5/Cxcr4/Rhoj",3
"GO:0032609","GO:0032609","interferon-gamma production","2/31","121/21092",0.0136154545319863,0.137146142577064,0.0981215223748235,"Ccr7/Fam49b",2
"GO:0090090","GO:0090090","negative regulation of canonical Wnt signaling pathway","2/31","122/21092",0.0138298122719515,0.137146142577064,0.0981215223748235,"Tmem131l/Tle4",2
"GO:0002866","GO:0002866","positive regulation of acute inflammatory response to antigenic stimulus","1/31","10/21092",0.0146037834420966,0.137146142577064,0.0981215223748235,"Ccr7",1
"GO:0006616","GO:0006616","SRP-dependent cotranslational protein targeting to membrane, translocation","1/31","10/21092",0.0146037834420966,0.137146142577064,0.0981215223748235,"Sec61b",1
"GO:0008300","GO:0008300","isoprenoid catabolic process","1/31","10/21092",0.0146037834420966,0.137146142577064,0.0981215223748235,"Cyp26b1",1
"GO:0033084","GO:0033084","regulation of immature T cell proliferation in thymus","1/31","10/21092",0.0146037834420966,0.137146142577064,0.0981215223748235,"Tmem131l",1
"GO:0033085","GO:0033085","negative regulation of T cell differentiation in thymus","1/31","10/21092",0.0146037834420966,0.137146142577064,0.0981215223748235,"Tmem131l",1
"GO:0070244","GO:0070244","negative regulation of thymocyte apoptotic process","1/31","10/21092",0.0146037834420966,0.137146142577064,0.0981215223748235,"Blm",1
"GO:0072710","GO:0072710","response to hydroxyurea","1/31","10/21092",0.0146037834420966,0.137146142577064,0.0981215223748235,"Blm",1
"GO:0097553","GO:0097553","calcium ion transmembrane import into cytosol","2/31","127/21092",0.0149236010664135,0.137146142577064,0.0981215223748235,"Itpr1/Camk2d",2
"GO:0044839","GO:0044839","cell cycle G2/M phase transition","2/31","131/21092",0.0158247638964592,0.137146142577064,0.0981215223748235,"Blm/Camk2d",2
"GO:0071887","GO:0071887","leukocyte apoptotic process","2/31","131/21092",0.0158247638964592,0.137146142577064,0.0981215223748235,"Blm/Ccr7",2
"GO:0002883","GO:0002883","regulation of hypersensitivity","1/31","11/21092",0.0160527580513981,0.137146142577064,0.0981215223748235,"Ccr7",1
"GO:0009111","GO:0009111","vitamin catabolic process","1/31","11/21092",0.0160527580513981,0.137146142577064,0.0981215223748235,"Cyp26b1",1
"GO:0033080","GO:0033080","immature T cell proliferation in thymus","1/31","11/21092",0.0160527580513981,0.137146142577064,0.0981215223748235,"Tmem131l",1
"GO:0061577","GO:0061577","calcium ion transmembrane transport via high voltage-gated calcium channel","1/31","11/21092",0.0160527580513981,0.137146142577064,0.0981215223748235,"Camk2d",1
"GO:0030010","GO:0030010","establishment of cell polarity","2/31","134/21092",0.016515693001932,0.137146142577064,0.0981215223748235,"Ccr7/Cyp26b1",2
"GO:0002824","GO:0002824","positive regulation of adaptive immune response based on somatic recombination of immune receptors built from immunoglobulin superfamily domains","2/31","137/21092",0.0172193958651782,0.137146142577064,0.0981215223748235,"Ccr7/Fam49b",2
"GO:0050671","GO:0050671","positive regulation of lymphocyte proliferation","2/31","137/21092",0.0172193958651782,0.137146142577064,0.0981215223748235,"Blm/Ccr7",2
"GO:0002524","GO:0002524","hypersensitivity","1/31","12/21092",0.0174996706504401,0.137146142577064,0.0981215223748235,"Ccr7",1
"GO:0002579","GO:0002579","positive regulation of antigen processing and presentation","1/31","12/21092",0.0174996706504401,0.137146142577064,0.0981215223748235,"Ccr7",1
"GO:0006620","GO:0006620","posttranslational protein targeting to endoplasmic reticulum membrane","1/31","12/21092",0.0174996706504401,0.137146142577064,0.0981215223748235,"Sec61b",1
"GO:0010882","GO:0010882","regulation of cardiac muscle contraction by calcium ion signaling","1/31","12/21092",0.0174996706504401,0.137146142577064,0.0981215223748235,"Atp1b1",1
"GO:0033083","GO:0033083","regulation of immature T cell proliferation","1/31","12/21092",0.0174996706504401,0.137146142577064,0.0981215223748235,"Tmem131l",1
"GO:0045625","GO:0045625","regulation of T-helper 1 cell differentiation","1/31","12/21092",0.0174996706504401,0.137146142577064,0.0981215223748235,"Ccr7",1
"GO:0061299","GO:0061299","retina vasculature morphogenesis in camera-type eye","1/31","12/21092",0.0174996706504401,0.137146142577064,0.0981215223748235,"Rhoj",1
"GO:0097329","GO:0097329","response to antimetabolite","1/31","12/21092",0.0174996706504401,0.137146142577064,0.0981215223748235,"Blm",1
"GO:0032946","GO:0032946","positive regulation of mononuclear cell proliferation","2/31","139/21092",0.0176955692364747,0.137146142577064,0.0981215223748235,"Blm/Ccr7",2
"GO:0003012","GO:0003012","muscle system process","3/31","383/21092",0.0183313857069268,0.137146142577064,0.0981215223748235,"Cxcr4/Camk2d/Atp1b1",3
"GO:0002821","GO:0002821","positive regulation of adaptive immune response","2/31","144/21092",0.0189103823227428,0.137146142577064,0.0981215223748235,"Ccr7/Fam49b",2
"GO:0009226","GO:0009226","nucleotide-sugar biosynthetic process","1/31","13/21092",0.0189445240759543,0.137146142577064,0.0981215223748235,"Gmds",1
"GO:0033079","GO:0033079","immature T cell proliferation","1/31","13/21092",0.0189445240759543,0.137146142577064,0.0981215223748235,"Tmem131l",1
"GO:0036376","GO:0036376","sodium ion export across plasma membrane","1/31","13/21092",0.0189445240759543,0.137146142577064,0.0981215223748235,"Atp1b1",1
"GO:2000650","GO:2000650","negative regulation of sodium ion transmembrane transporter activity","1/31","13/21092",0.0189445240759543,0.137146142577064,0.0981215223748235,"Camk2d",1
"GO:0070665","GO:0070665","positive regulation of leukocyte proliferation","2/31","145/21092",0.0191574897024268,0.137146142577064,0.0981215223748235,"Blm/Ccr7",2
"GO:0055067","GO:0055067","monovalent inorganic cation homeostasis","2/31","146/21092",0.0194059686229011,0.137146142577064,0.0981215223748235,"Camk2d/Atp1b1",2
"GO:0060402","GO:0060402","calcium ion transport into cytosol","2/31","148/21092",0.0199070239438862,0.137146142577064,0.0981215223748235,"Itpr1/Camk2d",2
"GO:1903169","GO:1903169","regulation of calcium ion transmembrane transport","2/31","149/21092",0.0201595917955283,0.137146142577064,0.0981215223748235,"Camk2d/Atp1b1",2
"GO:0001771","GO:0001771","immunological synapse formation","1/31","14/21092",0.0203873211609034,0.137146142577064,0.0981215223748235,"Ccr7",1
"GO:0010644","GO:0010644","cell communication by electrical coupling","1/31","14/21092",0.0203873211609034,0.137146142577064,0.0981215223748235,"Camk2d",1
"GO:0010820","GO:0010820","positive regulation of T cell chemotaxis","1/31","14/21092",0.0203873211609034,0.137146142577064,0.0981215223748235,"Ccr7",1
"GO:0050862","GO:0050862","positive regulation of T cell receptor signaling pathway","1/31","14/21092",0.0203873211609034,0.137146142577064,0.0981215223748235,"Ccr7",1
"GO:0051152","GO:0051152","positive regulation of smooth muscle cell differentiation","1/31","14/21092",0.0203873211609034,0.137146142577064,0.0981215223748235,"Olfm2",1
"GO:0070102","GO:0070102","interleukin-6-mediated signaling pathway","1/31","14/21092",0.0203873211609034,0.137146142577064,0.0981215223748235,"St18",1
"GO:1902306","GO:1902306","negative regulation of sodium ion transmembrane transport","1/31","14/21092",0.0203873211609034,0.137146142577064,0.0981215223748235,"Camk2d",1
"GO:1902570","GO:1902570","protein localization to nucleolus","1/31","14/21092",0.0203873211609034,0.137146142577064,0.0981215223748235,"Polr1a",1
"GO:1905063","GO:1905063","regulation of vascular smooth muscle cell differentiation","1/31","14/21092",0.0203873211609034,0.137146142577064,0.0981215223748235,"Klf5",1
"GO:2001267","GO:2001267","regulation of cysteine-type endopeptidase activity involved in apoptotic signaling pathway","1/31","14/21092",0.0203873211609034,0.137146142577064,0.0981215223748235,"St18",1
"GO:0030178","GO:0030178","negative regulation of Wnt signaling pathway","2/31","153/21092",0.021183365154554,0.137146142577064,0.0981215223748235,"Tmem131l/Tle4",2
"GO:0002863","GO:0002863","positive regulation of inflammatory response to antigenic stimulus","1/31","15/21092",0.0218280647344876,0.137146142577064,0.0981215223748235,"Ccr7",1
"GO:0003159","GO:0003159","morphogenesis of an endothelium","1/31","15/21092",0.0218280647344876,0.137146142577064,0.0981215223748235,"Cxcr4",1
"GO:0006677","GO:0006677","glycosylceramide metabolic process","1/31","15/21092",0.0218280647344876,0.137146142577064,0.0981215223748235,"B3galt2",1
"GO:0010819","GO:0010819","regulation of T cell chemotaxis","1/31","15/21092",0.0218280647344876,0.137146142577064,0.0981215223748235,"Ccr7",1
"GO:0032530","GO:0032530","regulation of microvillus organization","1/31","15/21092",0.0218280647344876,0.137146142577064,0.0981215223748235,"Klf5",1
"GO:0035020","GO:0035020","regulation of Rac protein signal transduction","1/31","15/21092",0.0218280647344876,0.137146142577064,0.0981215223748235,"Camk2d",1
"GO:0043217","GO:0043217","myelin maintenance","1/31","15/21092",0.0218280647344876,0.137146142577064,0.0981215223748235,"Cxcr4",1
"GO:0045060","GO:0045060","negative thymic T cell selection","1/31","15/21092",0.0218280647344876,0.137146142577064,0.0981215223748235,"Ccr7",1
"GO:0048385","GO:0048385","regulation of retinoic acid receptor signaling pathway","1/31","15/21092",0.0218280647344876,0.137146142577064,0.0981215223748235,"Cyp26b1",1
"GO:0051782","GO:0051782","negative regulation of cell division","1/31","15/21092",0.0218280647344876,0.137146142577064,0.0981215223748235,"Blm",1
"GO:0060055","GO:0060055","angiogenesis involved in wound healing","1/31","15/21092",0.0218280647344876,0.137146142577064,0.0981215223748235,"Cxcr4",1
"GO:0060576","GO:0060576","intestinal epithelial cell development","1/31","15/21092",0.0218280647344876,0.137146142577064,0.0981215223748235,"Klf5",1
"GO:0061154","GO:0061154","endothelial tube morphogenesis","1/31","15/21092",0.0218280647344876,0.137146142577064,0.0981215223748235,"Cxcr4",1
"GO:0071731","GO:0071731","response to nitric oxide","1/31","15/21092",0.0218280647344876,0.137146142577064,0.0981215223748235,"Ccr7",1
