"","ID","Description","GeneRatio","BgRatio","pvalue","p.adjust","qvalue","geneID","Count"
"GO:0002699","GO:0002699","positive regulation of immune effector process","2/31","250/21092",0.0519519813729026,0.156576826654508,0.112023249879786,"Ccr7/Fam49b",2
"GO:0009101","GO:0009101","glycoprotein biosynthetic process","2/31","252/21092",0.0526934967071453,0.156576826654508,0.112023249879786,"B3galt2/Ccr7",2
"GO:0009311","GO:0009311","oligosaccharide metabolic process","1/31","37/21092",0.0530105639886447,0.156576826654508,0.112023249879786,"B3galt2",1
"GO:0010661","GO:0010661","positive regulation of muscle cell apoptotic process","1/31","37/21092",0.0530105639886447,0.156576826654508,0.112023249879786,"Camk2d",1
"GO:0046640","GO:0046640","regulation of alpha-beta T cell proliferation","1/31","37/21092",0.0530105639886447,0.156576826654508,0.112023249879786,"Blm",1
"GO:0097028","GO:0097028","dendritic cell differentiation","1/31","37/21092",0.0530105639886447,0.156576826654508,0.112023249879786,"Ccr7",1
"GO:0048588","GO:0048588","developmental cell growth","2/31","255/21092",0.0538129640636128,0.156576826654508,0.112023249879786,"Cxcr4/Camk2d",2
"GO:0010831","GO:0010831","positive regulation of myotube differentiation","1/31","38/21092",0.054404849076099,0.156576826654508,0.112023249879786,"Cyp26b1",1
"GO:0032633","GO:0032633","interleukin-4 production","1/31","38/21092",0.054404849076099,0.156576826654508,0.112023249879786,"Cd83",1
"GO:0032781","GO:0032781","positive regulation of ATPase activity","1/31","38/21092",0.054404849076099,0.156576826654508,0.112023249879786,"Atp1b1",1
"GO:0045622","GO:0045622","regulation of T-helper cell differentiation","1/31","38/21092",0.054404849076099,0.156576826654508,0.112023249879786,"Ccr7",1
"GO:0050716","GO:0050716","positive regulation of interleukin-1 secretion","1/31","38/21092",0.054404849076099,0.156576826654508,0.112023249879786,"Ccr7",1
"GO:1901021","GO:1901021","positive regulation of calcium ion transmembrane transporter activity","1/31","38/21092",0.054404849076099,0.156576826654508,0.112023249879786,"Atp1b1",1
"GO:2000403","GO:2000403","positive regulation of lymphocyte migration","1/31","38/21092",0.054404849076099,0.156576826654508,0.112023249879786,"Ccr7",1
"GO:0032409","GO:0032409","regulation of transporter activity","2/31","258/21092",0.054940982867088,0.156576826654508,0.112023249879786,"Camk2d/Atp1b1",2
"GO:1901990","GO:1901990","regulation of mitotic cell cycle phase transition","2/31","260/21092",0.0556977010191154,0.156576826654508,0.112023249879786,"Blm/Camk2d",2
"GO:0003298","GO:0003298","physiological muscle hypertrophy","1/31","39/21092",0.0557971474364414,0.156576826654508,0.112023249879786,"Camk2d",1
"GO:0003301","GO:0003301","physiological cardiac muscle hypertrophy","1/31","39/21092",0.0557971474364414,0.156576826654508,0.112023249879786,"Camk2d",1
"GO:0006687","GO:0006687","glycosphingolipid metabolic process","1/31","39/21092",0.0557971474364414,0.156576826654508,0.112023249879786,"B3galt2",1
"GO:0007257","GO:0007257","activation of JUN kinase activity","1/31","39/21092",0.0557971474364414,0.156576826654508,0.112023249879786,"Ccr7",1
"GO:0010569","GO:0010569","regulation of double-strand break repair via homologous recombination","1/31","39/21092",0.0557971474364414,0.156576826654508,0.112023249879786,"Blm",1
"GO:0010613","GO:0010613","positive regulation of cardiac muscle hypertrophy","1/31","39/21092",0.0557971474364414,0.156576826654508,0.112023249879786,"Camk2d",1
"GO:0014742","GO:0014742","positive regulation of muscle hypertrophy","1/31","39/21092",0.0557971474364414,0.156576826654508,0.112023249879786,"Camk2d",1
"GO:0032392","GO:0032392","DNA geometric change","1/31","39/21092",0.0557971474364414,0.156576826654508,0.112023249879786,"Blm",1
"GO:0045005","GO:0045005","DNA-dependent DNA replication maintenance of fidelity","1/31","39/21092",0.0557971474364414,0.156576826654508,0.112023249879786,"Blm",1
"GO:0050856","GO:0050856","regulation of T cell receptor signaling pathway","1/31","39/21092",0.0557971474364414,0.156576826654508,0.112023249879786,"Ccr7",1
"GO:0061049","GO:0061049","cell growth involved in cardiac muscle cell development","1/31","39/21092",0.0557971474364414,0.156576826654508,0.112023249879786,"Camk2d",1
"GO:0071320","GO:0071320","cellular response to cAMP","1/31","39/21092",0.0557971474364414,0.156576826654508,0.112023249879786,"Itpr1",1
"GO:1902622","GO:1902622","regulation of neutrophil migration","1/31","39/21092",0.0557971474364414,0.156576826654508,0.112023249879786,"Ccr7",1
"GO:0010559","GO:0010559","regulation of glycoprotein biosynthetic process","1/31","40/21092",0.0571874618063395,0.158695206512592,0.113538849609662,"Ccr7",1
"GO:0046633","GO:0046633","alpha-beta T cell proliferation","1/31","40/21092",0.0571874618063395,0.158695206512592,0.113538849609662,"Blm",1
"GO:0090049","GO:0090049","regulation of cell migration involved in sprouting angiogenesis","1/31","40/21092",0.0571874618063395,0.158695206512592,0.113538849609662,"Rhoj",1
"GO:1990573","GO:1990573","potassium ion import across plasma membrane","1/31","40/21092",0.0571874618063395,0.158695206512592,0.113538849609662,"Atp1b1",1
"GO:0032527","GO:0032527","protein exit from endoplasmic reticulum","1/31","41/21092",0.0585757949188231,0.159014182401914,0.113767061641536,"Sec61b",1
"GO:0048246","GO:0048246","macrophage chemotaxis","1/31","41/21092",0.0585757949188231,0.159014182401914,0.113767061641536,"Ccr7",1
"GO:0050706","GO:0050706","regulation of interleukin-1 beta secretion","1/31","41/21092",0.0585757949188231,0.159014182401914,0.113767061641536,"Ccr7",1
"GO:0086009","GO:0086009","membrane repolarization","1/31","41/21092",0.0585757949188231,0.159014182401914,0.113767061641536,"Atp1b1",1
"GO:0097484","GO:0097484","dendrite extension","1/31","41/21092",0.0585757949188231,0.159014182401914,0.113767061641536,"Cxcr4",1
"GO:0098781","GO:0098781","ncRNA transcription","1/31","41/21092",0.0585757949188231,0.159014182401914,0.113767061641536,"Polr1a",1
"GO:1903672","GO:1903672","positive regulation of sprouting angiogenesis","1/31","41/21092",0.0585757949188231,0.159014182401914,0.113767061641536,"Rhoj",1
"GO:2000404","GO:2000404","regulation of T cell migration","1/31","41/21092",0.0585757949188231,0.159014182401914,0.113767061641536,"Ccr7",1
"GO:0072659","GO:0072659","protein localization to plasma membrane","2/31","271/21092",0.0599256620378673,0.161027385359628,0.115207412316725,"Camk2d/Atp1b1",2
"GO:0010765","GO:0010765","positive regulation of sodium ion transport","1/31","42/21092",0.059962149503285,0.161027385359628,0.115207412316725,"Atp1b1",1
"GO:0010972","GO:0010972","negative regulation of G2/M transition of mitotic cell cycle","1/31","42/21092",0.059962149503285,0.161027385359628,0.115207412316725,"Blm",1
"GO:1901381","GO:1901381","positive regulation of potassium ion transmembrane transport","1/31","42/21092",0.059962149503285,0.161027385359628,0.115207412316725,"Atp1b1",1
"GO:0001569","GO:0001569","branching involved in blood vessel morphogenesis","1/31","43/21092",0.0613465282854895,0.161702326536158,0.115690300530058,"Cxcr4",1
"GO:0001709","GO:0001709","cell fate determination","1/31","43/21092",0.0613465282854895,0.161702326536158,0.115690300530058,"Cyp26b1",1
"GO:0032731","GO:0032731","positive regulation of interleukin-1 beta production","1/31","43/21092",0.0613465282854895,0.161702326536158,0.115690300530058,"Ccr7",1
"GO:0045911","GO:0045911","positive regulation of DNA recombination","1/31","43/21092",0.0613465282854895,0.161702326536158,0.115690300530058,"Blm",1
"GO:0050974","GO:0050974","detection of mechanical stimulus involved in sensory perception","1/31","43/21092",0.0613465282854895,0.161702326536158,0.115690300530058,"Cxcr4",1
"GO:0070232","GO:0070232","regulation of T cell apoptotic process","1/31","43/21092",0.0613465282854895,0.161702326536158,0.115690300530058,"Blm",1
"GO:1902893","GO:1902893","regulation of pri-miRNA transcription by RNA polymerase II","1/31","43/21092",0.0613465282854895,0.161702326536158,0.115690300530058,"Klf5",1
"GO:0001523","GO:0001523","retinoid metabolic process","1/31","44/21092",0.0627289339875728,0.1644782284871,0.117676325949888,"Cyp26b1",1
"GO:0050891","GO:0050891","multicellular organismal water homeostasis","1/31","44/21092",0.0627289339875728,0.1644782284871,0.117676325949888,"Cyp26b1",1
"GO:0003254","GO:0003254","regulation of membrane depolarization","1/31","45/21092",0.0641093693280508,0.164640771102115,0.117792617436738,"Camk2d",1
"GO:0007131","GO:0007131","reciprocal meiotic recombination","1/31","45/21092",0.0641093693280508,0.164640771102115,0.117792617436738,"Blm",1
"GO:0010107","GO:0010107","potassium ion import","1/31","45/21092",0.0641093693280508,0.164640771102115,0.117792617436738,"Atp1b1",1
"GO:0035825","GO:0035825","homologous recombination","1/31","45/21092",0.0641093693280508,0.164640771102115,0.117792617436738,"Blm",1
"GO:0045581","GO:0045581","negative regulation of T cell differentiation","1/31","45/21092",0.0641093693280508,0.164640771102115,0.117792617436738,"Tmem131l",1
"GO:0045910","GO:0045910","negative regulation of DNA recombination","1/31","45/21092",0.0641093693280508,0.164640771102115,0.117792617436738,"Blm",1
"GO:0090279","GO:0090279","regulation of calcium ion import","1/31","45/21092",0.0641093693280508,0.164640771102115,0.117792617436738,"Cxcr4",1
"GO:1903018","GO:1903018","regulation of glycoprotein metabolic process","1/31","45/21092",0.0641093693280508,0.164640771102115,0.117792617436738,"Ccr7",1
"GO:0001916","GO:0001916","positive regulation of T cell mediated cytotoxicity","1/31","46/21092",0.0654878370218234,0.166469081895169,0.119100686588504,"Fam49b",1
"GO:0006303","GO:0006303","double-strand break repair via nonhomologous end joining","1/31","46/21092",0.0654878370218234,0.166469081895169,0.119100686588504,"Blm",1
"GO:0016101","GO:0016101","diterpenoid metabolic process","1/31","46/21092",0.0654878370218234,0.166469081895169,0.119100686588504,"Cyp26b1",1
"GO:0048713","GO:0048713","regulation of oligodendrocyte differentiation","1/31","46/21092",0.0654878370218234,0.166469081895169,0.119100686588504,"Cxcr4",1
"GO:0030111","GO:0030111","regulation of Wnt signaling pathway","2/31","287/21092",0.0662679585023751,0.167599216566767,0.119909244032279,"Tmem131l/Tle4",2
"GO:0034504","GO:0034504","protein localization to nucleus","2/31","287/21092",0.0662679585023751,0.167599216566767,0.119909244032279,"Sec61b/Polr1a",2
"GO:0050702","GO:0050702","interleukin-1 beta secretion","1/31","47/21092",0.0668643397801778,0.167832852865321,0.120076399658135,"Ccr7",1
"GO:0051489","GO:0051489","regulation of filopodium assembly","1/31","47/21092",0.0668643397801778,0.167832852865321,0.120076399658135,"Ccr7",1
"GO:1905517","GO:1905517","macrophage migration","1/31","47/21092",0.0668643397801778,0.167832852865321,0.120076399658135,"Ccr7",1
"GO:0031098","GO:0031098","stress-activated protein kinase signaling cascade","2/31","291/21092",0.0678878489117435,0.16915791918234,0.121024421394878,"Ccr7/Sbk2",2
"GO:1901987","GO:1901987","regulation of cell cycle phase transition","2/31","291/21092",0.0678878489117435,0.16915791918234,0.121024421394878,"Blm/Camk2d",2
"GO:0000060","GO:0000060","protein import into nucleus, translocation","1/31","48/21092",0.0682388803107939,0.16915791918234,0.121024421394878,"Sec61b",1
"GO:0042088","GO:0042088","T-helper 1 type immune response","1/31","48/21092",0.0682388803107939,0.16915791918234,0.121024421394878,"Ccr7",1
"GO:0071675","GO:0071675","regulation of mononuclear cell migration","1/31","48/21092",0.0682388803107939,0.16915791918234,0.121024421394878,"Ccr7",1
"GO:0051321","GO:0051321","meiotic cell cycle","2/31","293/21092",0.0687028016454627,0.1692015811592,0.1210556594564,"Blm/Cyp26b1",2
"GO:0030104","GO:0030104","water homeostasis","1/31","49/21092",0.0696114613177489,0.1692015811592,0.1210556594564,"Cyp26b1",1
"GO:0046513","GO:0046513","ceramide biosynthetic process","1/31","49/21092",0.0696114613177489,0.1692015811592,0.1210556594564,"B3galt2",1
"GO:0050704","GO:0050704","regulation of interleukin-1 secretion","1/31","49/21092",0.0696114613177489,0.1692015811592,0.1210556594564,"Ccr7",1
"GO:0070229","GO:0070229","negative regulation of lymphocyte apoptotic process","1/31","49/21092",0.0696114613177489,0.1692015811592,0.1210556594564,"Blm",1
"GO:0071300","GO:0071300","cellular response to retinoic acid","1/31","49/21092",0.0696114613177489,0.1692015811592,0.1210556594564,"Cyp26b1",1
"GO:0071622","GO:0071622","regulation of granulocyte chemotaxis","1/31","49/21092",0.0696114613177489,0.1692015811592,0.1210556594564,"Ccr7",1
"GO:0090329","GO:0090329","regulation of DNA-dependent DNA replication","1/31","49/21092",0.0696114613177489,0.1692015811592,0.1210556594564,"Blm",1
"GO:0002460","GO:0002460","adaptive immune response based on somatic recombination of immune receptors built from immunoglobulin superfamily domains","2/31","296/21092",0.0699314195861092,0.169566718850784,0.121316898055616,"Ccr7/Fam49b",2
"GO:0060326","GO:0060326","cell chemotaxis","2/31","298/21092",0.0707545877346556,0.170870128713304,0.122249425632299,"Cxcr4/Ccr7",2
"GO:0007140","GO:0007140","male meiotic nuclear division","1/31","50/21092",0.0709820855015229,0.170870128713304,0.122249425632299,"Cyp26b1",1
"GO:0055078","GO:0055078","sodium ion homeostasis","1/31","50/21092",0.0709820855015229,0.170870128713304,0.122249425632299,"Atp1b1",1
"GO:0001914","GO:0001914","regulation of T cell mediated cytotoxicity","1/31","51/21092",0.0723507555590007,0.171012332622752,0.122351165745587,"Fam49b",1
"GO:0010665","GO:0010665","regulation of cardiac muscle cell apoptotic process","1/31","51/21092",0.0723507555590007,0.171012332622752,0.122351165745587,"Camk2d",1
"GO:0032732","GO:0032732","positive regulation of interleukin-1 production","1/31","51/21092",0.0723507555590007,0.171012332622752,0.122351165745587,"Ccr7",1
"GO:0043268","GO:0043268","positive regulation of potassium ion transport","1/31","51/21092",0.0723507555590007,0.171012332622752,0.122351165745587,"Atp1b1",1
"GO:0048806","GO:0048806","genitalia development","1/31","51/21092",0.0723507555590007,0.171012332622752,0.122351165745587,"Asb1",1
"GO:0061614","GO:0061614","pri-miRNA transcription by RNA polymerase II","1/31","51/21092",0.0723507555590007,0.171012332622752,0.122351165745587,"Klf5",1
"GO:0070542","GO:0070542","response to fatty acid","1/31","51/21092",0.0723507555590007,0.171012332622752,0.122351165745587,"Ccr7",1
"GO:0051146","GO:0051146","striated muscle cell differentiation","2/31","302/21092",0.072410627326751,0.171012332622752,0.122351165745587,"Cyp26b1/Camk2d",2
"GO:0045765","GO:0045765","regulation of angiogenesis","2/31","303/21092",0.0728266407675687,0.171264550486737,0.122531615595063,"Cxcr4/Rhoj",2
"GO:0000726","GO:0000726","non-recombinational repair","1/31","52/21092",0.0737174741834803,0.171264550486737,0.122531615595063,"Blm",1
"GO:0032653","GO:0032653","regulation of interleukin-10 production","1/31","52/21092",0.0737174741834803,0.171264550486737,0.122531615595063,"Cd83",1
"GO:0032655","GO:0032655","regulation of interleukin-12 production","1/31","52/21092",0.0737174741834803,0.171264550486737,0.122531615595063,"Ccr7",1
"GO:0045687","GO:0045687","positive regulation of glial cell differentiation","1/31","52/21092",0.0737174741834803,0.171264550486737,0.122531615595063,"Cxcr4",1
"GO:0050854","GO:0050854","regulation of antigen receptor-mediated signaling pathway","1/31","52/21092",0.0737174741834803,0.171264550486737,0.122531615595063,"Ccr7",1
"GO:0072678","GO:0072678","T cell migration","1/31","52/21092",0.0737174741834803,0.171264550486737,0.122531615595063,"Ccr7",1
"GO:0009100","GO:0009100","glycoprotein metabolic process","2/31","308/21092",0.0749185761555401,0.172346213724662,0.123305494040404,"B3galt2/Ccr7",2
"GO:0006721","GO:0006721","terpenoid metabolic process","1/31","53/21092",0.0750822440646739,0.172346213724662,0.123305494040404,"Cyp26b1",1
"GO:0048247","GO:0048247","lymphocyte chemotaxis","1/31","53/21092",0.0750822440646739,0.172346213724662,0.123305494040404,"Ccr7",1
"GO:1902750","GO:1902750","negative regulation of cell cycle G2/M phase transition","1/31","53/21092",0.0750822440646739,0.172346213724662,0.123305494040404,"Blm",1
"GO:0002437","GO:0002437","inflammatory response to antigenic stimulus","1/31","54/21092",0.0764450678887142,0.172346213724662,0.123305494040404,"Ccr7",1
"GO:0010662","GO:0010662","regulation of striated muscle cell apoptotic process","1/31","54/21092",0.0764450678887142,0.172346213724662,0.123305494040404,"Camk2d",1
"GO:0045620","GO:0045620","negative regulation of lymphocyte differentiation","1/31","54/21092",0.0764450678887142,0.172346213724662,0.123305494040404,"Tmem131l",1
"GO:0050879","GO:0050879","multicellular organismal movement","1/31","54/21092",0.0764450678887142,0.172346213724662,0.123305494040404,"Itpr1",1
"GO:0050881","GO:0050881","musculoskeletal movement","1/31","54/21092",0.0764450678887142,0.172346213724662,0.123305494040404,"Itpr1",1
"GO:0086001","GO:0086001","cardiac muscle cell action potential","1/31","54/21092",0.0764450678887142,0.172346213724662,0.123305494040404,"Camk2d",1
"GO:0090303","GO:0090303","positive regulation of wound healing","1/31","54/21092",0.0764450678887142,0.172346213724662,0.123305494040404,"Cxcr4",1
"GO:1990823","GO:1990823","response to leukemia inhibitory factor","2/31","312/21092",0.0766061840128795,0.172346213724662,0.123305494040404,"Klf5/Tle4",2
"GO:1990830","GO:1990830","cellular response to leukemia inhibitory factor","2/31","312/21092",0.0766061840128795,0.172346213724662,0.123305494040404,"Klf5/Tle4",2
"GO:0051235","GO:0051235","maintenance of location","2/31","314/21092",0.0774546080652767,0.172346213724662,0.123305494040404,"Itpr1/Camk2d",2
"GO:0010659","GO:0010659","cardiac muscle cell apoptotic process","1/31","55/21092",0.0778059483381606,0.172346213724662,0.123305494040404,"Camk2d",1
"GO:0032613","GO:0032613","interleukin-10 production","1/31","55/21092",0.0778059483381606,0.172346213724662,0.123305494040404,"Cd83",1
"GO:0032615","GO:0032615","interleukin-12 production","1/31","55/21092",0.0778059483381606,0.172346213724662,0.123305494040404,"Ccr7",1
"GO:0045058","GO:0045058","T cell selection","1/31","55/21092",0.0778059483381606,0.172346213724662,0.123305494040404,"Ccr7",1
"GO:0048260","GO:0048260","positive regulation of receptor-mediated endocytosis","1/31","55/21092",0.0778059483381606,0.172346213724662,0.123305494040404,"Ccr7",1
"GO:2000401","GO:2000401","regulation of lymphocyte migration","1/31","55/21092",0.0778059483381606,0.172346213724662,0.123305494040404,"Ccr7",1
"GO:2000648","GO:2000648","positive regulation of stem cell proliferation","1/31","55/21092",0.0778059483381606,0.172346213724662,0.123305494040404,"Nfya",1
"GO:0009247","GO:0009247","glycolipid biosynthetic process","1/31","56/21092",0.079164888092,0.17419762820244,0.124630092776415,"B3galt2",1
"GO:0050701","GO:0050701","interleukin-1 secretion","1/31","56/21092",0.079164888092,0.17419762820244,0.124630092776415,"Ccr7",1
"GO:0070972","GO:0070972","protein localization to endoplasmic reticulum","1/31","56/21092",0.079164888092,0.17419762820244,0.124630092776415,"Sec61b",1
"GO:0002042","GO:0002042","cell migration involved in sprouting angiogenesis","1/31","57/21092",0.0805218898256539,0.17552592114758,0.125580423011651,"Rhoj",1
"GO:0043536","GO:0043536","positive regulation of blood vessel endothelial cell migration","1/31","57/21092",0.0805218898256539,0.17552592114758,0.125580423011651,"Rhoj",1
"GO:0051148","GO:0051148","negative regulation of muscle cell differentiation","1/31","57/21092",0.0805218898256539,0.17552592114758,0.125580423011651,"Klf5",1
"GO:0098900","GO:0098900","regulation of action potential","1/31","57/21092",0.0805218898256539,0.17552592114758,0.125580423011651,"Camk2d",1
"GO:0002673","GO:0002673","regulation of acute inflammatory response","1/31","58/21092",0.0818769562109835,0.17552592114758,0.125580423011651,"Ccr7",1
"GO:0010658","GO:0010658","striated muscle cell apoptotic process","1/31","58/21092",0.0818769562109835,0.17552592114758,0.125580423011651,"Camk2d",1
"GO:0033209","GO:0033209","tumor necrosis factor-mediated signaling pathway","1/31","58/21092",0.0818769562109835,0.17552592114758,0.125580423011651,"St18",1
"GO:0044773","GO:0044773","mitotic DNA damage checkpoint","1/31","58/21092",0.0818769562109835,0.17552592114758,0.125580423011651,"Blm",1
"GO:0050982","GO:0050982","detection of mechanical stimulus","1/31","58/21092",0.0818769562109835,0.17552592114758,0.125580423011651,"Cxcr4",1
"GO:0065002","GO:0065002","intracellular protein transmembrane transport","1/31","58/21092",0.0818769562109835,0.17552592114758,0.125580423011651,"Sec61b",1
"GO:0070231","GO:0070231","T cell apoptotic process","1/31","58/21092",0.0818769562109835,0.17552592114758,0.125580423011651,"Blm",1
"GO:1901016","GO:1901016","regulation of potassium ion transmembrane transporter activity","1/31","58/21092",0.0818769562109835,0.17552592114758,0.125580423011651,"Atp1b1",1
"GO:0032663","GO:0032663","regulation of interleukin-2 production","1/31","59/21092",0.083230089916292,0.177285415408051,0.126839257217287,"Cd83",1
"GO:0043462","GO:0043462","regulation of ATPase activity","1/31","59/21092",0.083230089916292,0.177285415408051,0.126839257217287,"Atp1b1",1
"GO:0071806","GO:0071806","protein transmembrane transport","1/31","59/21092",0.083230089916292,0.177285415408051,0.126839257217287,"Sec61b",1
"GO:1904062","GO:1904062","regulation of cation transmembrane transport","2/31","328/21092",0.0834775963836671,0.177434295292092,0.126945773671915,"Camk2d/Atp1b1",2
"GO:0014911","GO:0014911","positive regulation of smooth muscle cell migration","1/31","60/21092",0.0845812936063314,0.177887815395211,0.127270245670247,"Camk2d",1
"GO:0046847","GO:0046847","filopodium assembly","1/31","60/21092",0.0845812936063314,0.177887815395211,0.127270245670247,"Ccr7",1
"GO:0050766","GO:0050766","positive regulation of phagocytosis","1/31","60/21092",0.0845812936063314,0.177887815395211,0.127270245670247,"Ccr7",1
"GO:0086003","GO:0086003","cardiac muscle cell contraction","1/31","60/21092",0.0845812936063314,0.177887815395211,0.127270245670247,"Camk2d",1
"GO:1905207","GO:1905207","regulation of cardiocyte differentiation","1/31","60/21092",0.0845812936063314,0.177887815395211,0.127270245670247,"Klf5",1
"GO:0019221","GO:0019221","cytokine-mediated signaling pathway","2/31","332/21092",0.0852247517212693,0.178864552457034,0.127969054442154,"St18/Cxcr4",2
"GO:0046579","GO:0046579","positive regulation of Ras protein signal transduction","1/31","61/21092",0.0859305699423052,0.179591295758081,0.128489004604328,"Camk2d",1
"GO:0070059","GO:0070059","intrinsic apoptotic signaling pathway in response to endoplasmic reticulum stress","1/31","61/21092",0.0859305699423052,0.179591295758081,0.128489004604328,"Itpr1",1
"GO:0006487","GO:0006487","protein N-linked glycosylation","1/31","62/21092",0.0872779215818748,0.180145957975812,0.12888583896062,"B3galt2",1
"GO:0009988","GO:0009988","cell-cell recognition","1/31","62/21092",0.0872779215818748,0.180145957975812,0.12888583896062,"Ccr7",1
"GO:0010830","GO:0010830","regulation of myotube differentiation","1/31","62/21092",0.0872779215818748,0.180145957975812,0.12888583896062,"Cyp26b1",1
"GO:0042093","GO:0042093","T-helper cell differentiation","1/31","62/21092",0.0872779215818748,0.180145957975812,0.12888583896062,"Ccr7",1
"GO:0045600","GO:0045600","positive regulation of fat cell differentiation","1/31","62/21092",0.0872779215818748,0.180145957975812,0.12888583896062,"Klf5",1
"GO:0045739","GO:0045739","positive regulation of DNA repair","1/31","62/21092",0.0872779215818748,0.180145957975812,0.12888583896062,"Blm",1
"GO:1990778","GO:1990778","protein localization to cell periphery","2/31","338/21092",0.0878667079160195,0.180987301460007,0.129487780086766,"Camk2d/Atp1b1",2
"GO:0002294","GO:0002294","CD4-positive, alpha-beta T cell differentiation involved in immune response","1/31","63/21092",0.0886233511791628,0.181052613145161,0.12953450748176,"Ccr7",1
"GO:0035904","GO:0035904","aorta development","1/31","63/21092",0.0886233511791628,0.181052613145161,0.12953450748176,"Cxcr4",1
"GO:0070098","GO:0070098","chemokine-mediated signaling pathway","1/31","63/21092",0.0886233511791628,0.181052613145161,0.12953450748176,"Cxcr4",1
"GO:0071479","GO:0071479","cellular response to ionizing radiation","1/31","63/21092",0.0886233511791628,0.181052613145161,0.12953450748176,"Blm",1
"GO:0002293","GO:0002293","alpha-beta T cell differentiation involved in immune response","1/31","64/21092",0.0899668613847571,0.183048665017052,0.130962587373245,"Ccr7",1
"GO:0032651","GO:0032651","regulation of interleukin-1 beta production","1/31","64/21092",0.0899668613847571,0.183048665017052,0.130962587373245,"Ccr7",1
"GO:0002287","GO:0002287","alpha-beta T cell activation involved in immune response","1/31","65/21092",0.0913084548457176,0.184650093908648,0.132108333348055,"Ccr7",1
"GO:0030433","GO:0030433","ubiquitin-dependent ERAD pathway","1/31","65/21092",0.0913084548457176,0.184650093908648,0.132108333348055,"Sec61b",1
"GO:0055117","GO:0055117","regulation of cardiac muscle contraction","1/31","65/21092",0.0913084548457176,0.184650093908648,0.132108333348055,"Atp1b1",1
"GO:0042060","GO:0042060","wound healing","2/31","348/21092",0.0923250485513009,0.185854389701551,0.132969949536224,"Cxcr4/Sdc1",2
"GO:0032413","GO:0032413","negative regulation of ion transmembrane transporter activity","1/31","66/21092",0.092648134205578,0.185854389701551,0.132969949536224,"Camk2d",1
"GO:0044774","GO:0044774","mitotic DNA integrity checkpoint","1/31","66/21092",0.092648134205578,0.185854389701551,0.132969949536224,"Blm",1
"GO:2000779","GO:2000779","regulation of double-strand break repair","1/31","66/21092",0.092648134205578,0.185854389701551,0.132969949536224,"Blm",1
